tax_id	accession	size	species	genus	family	brief	description	num_reads	cov_bases	coverage	mean_depth	mean_baseq	mean_mapq
185938	MN369043.1	7048	Rhinovirus B (147712)	Enterovirus (12059)	Picornaviridae (12058)	rhinovirus B86	Rhinovirus B86 strain SC9785, complete genome	13784	6772	96.084	263.694	33.7	19.9
208893	OM857190.1	14977	Orthopneumovirus hominis (3049954)	Orthopneumovirus (1868215)	Pneumoviridae (11244)	Human respiratory syncytial virus A	Human respiratory syncytial virus A strain hRSV/A/Australia/3010918/2021, partial genome	4093	11861	79.1948	37.044	33.6	6.5
11250	KU950544.1	15234	Orthopneumovirus hominis (3049954)	Orthopneumovirus (1868215)	Pneumoviridae (11244)	Human orthopneumovirus	Human orthopneumovirus strain RSVA/Homo sapiens/USA/TH_10438/2013, complete genome	2524	9333	61.2643	21.6549	33.6	2.06
1439707	KJ627734.1	15169	Orthopneumovirus hominis (3049954)	Orthopneumovirus (1868215)	Pneumoviridae (11244)	Respiratory syncytial virus type A	Respiratory syncytial virus type A isolate RSV-A/US/BID-V8702/2013, partial genome	2553	9458	62.3508	22.1211	33.6	3.1
12814	JX503101.1	15357	Orthopneumovirus bovis (3050248)	Orthopneumovirus (1868215)	Pneumoviridae (11244)	Respiratory syncytial virus	UNVERIFIED: Respiratory syncytial virus isolate RSV/USA/BID-V6103 genomic sequence	1420	8159	53.1289	11.82	33.6	1.11
208895	OQ941660.1	15005	Orthopneumovirus hominis (3049954)	Orthopneumovirus (1868215)	Pneumoviridae (11244)	Human respiratory syncytial virus B	Human respiratory syncytial virus B strain RSVB/Australia/80_S79/2018, partial genome	471	1608	10.7164	4.15761	33.6	0.994
